### ISSUE TITLE
unable to load images from users on some servers; tls errors in logs

### ISSUE THREAD

**Issue by linkandzelda91** [element-hq/ess-helm#727]
**Describe the bug**
I dont seem to be able to load images from certain servers.
when I checked logs for the synapse container and filtered for the user/server, I saw stuff like this:
```
2025-09-11 00:12:08,460 - synapse.media.media_repository - 963 - WARNING - GET-836 - Not retrying destination 'nerdyredneck.net'
2025-09-11 00:12:08,460 - synapse.http.server - 133 - INFO - GET-836 - <XForwardedForRequest at 0x7ad43192c440 method='GET' uri='/_matrix/client/v1/media/thumbnail/nerdyredneck.net/cPVTFsHCAwONvssCHMFcynpn?width=96&height=96&method=crop&allow_redirect=true' clientproto='HTTP/1.1' site='8008'> SynapseError: 502 - Failed to fetch remote media
2025-09-11 00:12:08,462 - synapse.access.http.8008 - 515 - INFO - GET-836 - 10.42.0.1 - 8008 - {@gdewitt:mayogirl.com} Processed request: 0.006sec/0.002sec (0.003sec, 0.000sec) (0.001sec/0.001sec/1) 62B 502 "GET /_matrix/client/v1/media/thumbnail/nerdyredneck.net/cPVTFsHCAwONvssCHMFcynpn?width=96&height=96&method=crop&allow_redirect=true HTTP/1.1" "Mozilla/5.0 (Windows NT 10.0; Win64; x64) AppleWebKit/537.36 (KHTML, like Gecko) Element/1.11.110 Chrome/138.0.7204.168 Electron/37.2.5 Safari/537.36" [0 dbevts]
2025-09-11 00:12:08,497 - synapse.media.media_repository - 963 - WARNING - GET-841 - Not retrying destination 'nerdyredneck.net'
2025-09-11 00:12:08,497 - synapse.http.server - 133 - INFO - GET-841 - <XForwardedForRequest at 0x7ad427711550 method='GET' uri='/_matrix/client/v1/media/thumbnail/nerdyredneck.net/mFvWEojaXRAiXbdqTCKJTScn?width=96&height=96&method=crop&allow_redirect=true' clientproto='HTTP/1.1' site='8008'> SynapseError: 502 - Failed to fetch remote media
```

I opened up bash in the synapse container and tried to curl it and got a tls error I do not understand. I then found out that I get this error with https:google.com even, the host that is running the deployment doesn't get this error:
```
I have no name!@ess-synapse-main-0:/$ curl https://google.com
curl: (35) OpenSSL/3.0.17: error:0A000458:SSL routines::tlsv1 unrecognized name
```

filtering logs again, I find this error littered everywhere as well:
```
2025-09-11 00:14:40,536 - synapse.http.matrixfederationclient - 826 - INFO - federation_transaction_transmission_loop-67 - {PUT-O-51} [ruby-code.com] Request failed: PUT matrix-federation://ruby-code.com/_matrix/federation/v1/send/1757549170631: RequestTransmissionFailed:[Error([('SSL routines', '', 'tlsv1 unrecognized name')])]
2025-09-11 00:14:40,649 - synapse.http.matrixfederationclient - 826 - INFO - _maybe_retry_device_resync-19 - {GET-O-505} [brodi.me] Request failed: GET matrix-federation://brodi.me/_matrix/federation/v1/user/devices/%40elwood%3Abrodi.me: ResponseNeverReceived:[Error([('SSL routines', '', 'tlsv1 unrecognized name')])]
2025-09-11 00:14:40,650 - synapse.util.retryutils - 296 - INFO - _maybe_retry_device_resync-19 - Connection to brodi.me was unsuccessful (<class 'synapse.api.errors.RequestSendFailed'>(Failed to send request: ResponseNeverReceived: [<twisted.python.failure.Failure OpenSSL.SSL.Error: [('SSL routines', '', 'tlsv1 unrecognized name')]>])); backoff now 600000
2025-09-11 00:14:40,650 - synapse.handlers.device - 1770 - WARNING - _maybe_retry_device_resync-19 - Failed to handle device list update for @elwood:brodi.me: Failed to send request: ResponseNeverReceived: [<twisted.python.failure.Failure OpenSSL.SSL.Error: [('SSL routines', '', 'tlsv1 unrecognized name')]>]
2025-09-11 00:14:40,674 - synapse.http.federation.well_known_resolver - 309 - INFO - _maybe_retry_device_resync-19 - Error fetching https://the-apothecary.club/.well-known/matrix/server: [<twisted.python.failure.Failure OpenSSL.SSL.Error: [('SSL routines', '', 'tlsv1 unrecognized name')]>]
```

**To Reproduce**
in my case, deploy the helm chart with
helm upgrade --install --namespace "ess" ess oci://ghcr.io/element-hq/ess-helm/matrix-stack --version 25.9.0 -f ~/ess-config-values/hostnames.yaml -f ~/ess-config-values/tls.yaml  -f ~/ess-config-values/troubleshooting.yaml --wait

hostnames and tls you can probably guess, the troubleshooting.yaml is overrides for the rtc-sfu pod to resolve issues with it coming up.

**Desktop (please complete the following information):**
windows 24H2, element client

**Smartphone (please complete the following information):**
oneplus 12, element client

**Comment by linkandzelda91** [comment]
also...not sure if I'm chasing the wrong thing here with the logs, just it was the first thing to pop out when I grep'd them for one of the server names that I wasn't able to view images from users of.

**Comment by linkandzelda91** [comment]
lil update, I tested openssl. in container:
```
I have no name!@ess-synapse-main-0:/$ openssl s_client -connect google.com:443
CONNECTED(00000003)
804118F08B7A0000:error:0A000458:SSL routines:ssl3_read_bytes:tlsv1 unrecognized name:../ssl/record/rec_layer_s3.c:1605:SSL alert number 112
---
no peer certificate available
---
No client certificate CA names sent
---
SSL handshake has read 7 bytes and written 316 bytes
Verification: OK
---
New, (NONE), Cipher is (NONE)
Secure Renegotiation IS NOT supported
Compression: NONE
Expansion: NONE
No ALPN negotiated
Early data was not sent
Verify return code: 0 (ok)
---
```

meanwhile if I run it on the k3s host:
```
gdewitt@k3s:~$ openssl s_client -connect google.com:443
Connecting to 142.251.116.101
CONNECTED(00000003)
depth=2 C=US, O=Google Trust Services LLC, CN=GTS Root R4
verify return:1
depth=1 C=US, O=Google Trust Services, CN=WE2
verify return:1
depth=0 CN=*.google.com
verify return:1
---
Certificate chain
 0 s:CN=*.google.com
   i:C=US, O=Google Trust Services, CN=WE2
   a:PKEY: id-ecPublicKey, 256 (bit); sigalg: ecdsa-with-SHA256
   v:NotBefore: Aug 25 08:39:53 2025 GMT; NotAfter: Nov 17 08:39:52 2025 GMT
 1 s:C=US, O=Google Trust Services, CN=WE2
   i:C=US, O=Google Trust Services LLC, CN=GTS Root R4
   a:PKEY: id-ecPublicKey, 256 (bit); sigalg: ecdsa-with-SHA384
   v:NotBefore: Dec 13 09:00:00 2023 GMT; NotAfter: Feb 20 14:00:00 2029 GMT
 2 s:C=US, O=Google Trust Services LLC, CN=GTS Root R4
   i:C=BE, O=GlobalSign nv-sa, OU=Root CA, CN=GlobalSign Root CA
   a:PKEY: id-ecPublicKey, 384 (bit); sigalg: RSA-SHA256
   v:NotBefore: Nov 15 03:43:21 2023 GMT; NotAfter: Jan 28 00:00:42 2028 GMT
---
Server certificate
-----BEGIN CERTIFICATE-----
MIINbTCCDRSgAwIBAgIRAI8g9PrbKaN7EnZS05d+Sx8wCgYIKoZIzj0EAwIwOzEL
MAkGA1UEBhMCVVMxHjAcBgNVBAoTFUdvb2dsZSBUcnVzdCBTZXJ2aWNlczEMMAoG
A1UEAxMDV0UyMB4XDTI1MDgyNTA4Mzk1M1oXDTI1MTExNzA4Mzk1MlowFzEVMBMG
A1UEAwwMKi5nb29nbGUuY29tMFkwEwYHKoZIzj0CAQYIKoZIzj0DAQcDQgAEyDY+
Q/FYBTNP04RKh1k4H0VdGFJAkeZgFBhB9KKtLly2WNCbF73bxCfnluoWC8EtrP9+
KJh/2hPy4nG/b1+p26OCDBswggwXMA4GA1UdDwEB/wQEAwIHgDATBgNVHSUEDDAK
BggrBgEFBQcDATAMBgNVHRMBAf8EAjAAMB0GA1UdDgQWBBTmb4D5m4H5yDzg8Ua8
hgQ38C/tnzAfBgNVHSMEGDAWgBR1vsR3ron2RDd9z7FoHx0a69w0WTBYBggrBgEF
BQcBAQRMMEowIQYIKwYBBQUHMAGGFWh0dHA6Ly9vLnBraS5nb29nL3dlMjAlBggr
BgEFBQcwAoYZaHR0cDovL2kucGtpLmdvb2cvd2UyLmNydDCCCfAGA1UdEQSCCecw
ggnjggwqLmdvb2dsZS5jb22CFiouYXBwZW5naW5lLmdvb2dsZS5jb22CCSouYmRu
LmRldoIVKi5vcmlnaW4tdGVzdC5iZG4uZGV2ghIqLmNsb3VkLmdvb2dsZS5jb22C
GCouY3Jvd2Rzb3VyY2UuZ29vZ2xlLmNvbYIYKi5kYXRhY29tcHV0ZS5nb29nbGUu
Y29tggsqLmdvb2dsZS5jYYILKi5nb29nbGUuY2yCDiouZ29vZ2xlLmNvLmlugg4q
Lmdvb2dsZS5jby5qcIIOKi5nb29nbGUuY28udWuCDyouZ29vZ2xlLmNvbS5hcoIP
Ki5nb29nbGUuY29tLmF1gg8qLmdvb2dsZS5jb20uYnKCDyouZ29vZ2xlLmNvbS5j
b4IPKi5nb29nbGUuY29tLm14gg8qLmdvb2dsZS5jb20udHKCDyouZ29vZ2xlLmNv
bS52boILKi5nb29nbGUuZGWCCyouZ29vZ2xlLmVzggsqLmdvb2dsZS5mcoILKi5n
b29nbGUuaHWCCyouZ29vZ2xlLml0ggsqLmdvb2dsZS5ubIILKi5nb29nbGUucGyC
CyouZ29vZ2xlLnB0gg8qLmdvb2dsZWFwaXMuY26CESouZ29vZ2xldmlkZW8uY29t
ggwqLmdzdGF0aWMuY26CECouZ3N0YXRpYy1jbi5jb22CD2dvb2dsZWNuYXBwcy5j
boIRKi5nb29nbGVjbmFwcHMuY26CEWdvb2dsZWFwcHMtY24uY29tghMqLmdvb2ds
ZWFwcHMtY24uY29tggxna2VjbmFwcHMuY26CDiouZ2tlY25hcHBzLmNughJnb29n
bGVkb3dubG9hZHMuY26CFCouZ29vZ2xlZG93bmxvYWRzLmNughByZWNhcHRjaGEu
bmV0LmNughIqLnJlY2FwdGNoYS5uZXQuY26CEHJlY2FwdGNoYS1jbi5uZXSCEiou
cmVjYXB0Y2hhLWNuLm5ldIILd2lkZXZpbmUuY26CDSoud2lkZXZpbmUuY26CEWFt
cHByb2plY3Qub3JnLmNughMqLmFtcHByb2plY3Qub3JnLmNughFhbXBwcm9qZWN0
Lm5ldC5jboITKi5hbXBwcm9qZWN0Lm5ldC5jboIXZ29vZ2xlLWFuYWx5dGljcy1j
bi5jb22CGSouZ29vZ2xlLWFuYWx5dGljcy1jbi5jb22CF2dvb2dsZWFkc2Vydmlj
ZXMtY24uY29tghkqLmdvb2dsZWFkc2VydmljZXMtY24uY29tghFnb29nbGV2YWRz
LWNuLmNvbYITKi5nb29nbGV2YWRzLWNuLmNvbYIRZ29vZ2xlYXBpcy1jbi5jb22C
EyouZ29vZ2xlYXBpcy1jbi5jb22CFWdvb2dsZW9wdGltaXplLWNuLmNvbYIXKi5n
b29nbGVvcHRpbWl6ZS1jbi5jb22CEmRvdWJsZWNsaWNrLWNuLm5ldIIUKi5kb3Vi
bGVjbGljay1jbi5uZXSCGCouZmxzLmRvdWJsZWNsaWNrLWNuLm5ldIIWKi5nLmRv
dWJsZWNsaWNrLWNuLm5ldIIOZG91YmxlY2xpY2suY26CECouZG91YmxlY2xpY2su
Y26CFCouZmxzLmRvdWJsZWNsaWNrLmNughIqLmcuZG91YmxlY2xpY2suY26CEWRh
cnRzZWFyY2gtY24ubmV0ghMqLmRhcnRzZWFyY2gtY24ubmV0gh1nb29nbGV0cmF2
ZWxhZHNlcnZpY2VzLWNuLmNvbYIfKi5nb29nbGV0cmF2ZWxhZHNlcnZpY2VzLWNu
LmNvbYIYZ29vZ2xldGFnc2VydmljZXMtY24uY29tghoqLmdvb2dsZXRhZ3NlcnZp
Y2VzLWNuLmNvbYIXZ29vZ2xldGFnbWFuYWdlci1jbi5jb22CGSouZ29vZ2xldGFn
bWFuYWdlci1jbi5jb22CGGdvb2dsZXN5bmRpY2F0aW9uLWNuLmNvbYIaKi5nb29n
bGVzeW5kaWNhdGlvbi1jbi5jb22CJCouc2FmZWZyYW1lLmdvb2dsZXN5bmRpY2F0
aW9uLWNuLmNvbYIWYXBwLW1lYXN1cmVtZW50LWNuLmNvbYIYKi5hcHAtbWVhc3Vy
ZW1lbnQtY24uY29tggtndnQxLWNuLmNvbYINKi5ndnQxLWNuLmNvbYILZ3Z0Mi1j
bi5jb22CDSouZ3Z0Mi1jbi5jb22CCzJtZG4tY24ubmV0gg0qLjJtZG4tY24ubmV0
ghRnb29nbGVmbGlnaHRzLWNuLm5ldIIWKi5nb29nbGVmbGlnaHRzLWNuLm5ldIIM
YWRtb2ItY24uY29tgg4qLmFkbW9iLWNuLmNvbYIUZ29vZ2xlc2FuZGJveC1jbi5j
b22CFiouZ29vZ2xlc2FuZGJveC1jbi5jb22CHiouc2FmZW51cC5nb29nbGVzYW5k
Ym94LWNuLmNvbYINKi5nc3RhdGljLmNvbYIUKi5tZXRyaWMuZ3N0YXRpYy5jb22C
CiouZ3Z0MS5jb22CESouZ2NwY2RuLmd2dDEuY29tggoqLmd2dDIuY29tgg4qLmdj
cC5ndnQyLmNvbYIQKi51cmwuZ29vZ2xlLmNvbYIWKi55b3V0dWJlLW5vY29va2ll
LmNvbYILKi55dGltZy5jb22CCmFpLmFuZHJvaWSCC2FuZHJvaWQuY29tgg0qLmFu
ZHJvaWQuY29tghMqLmZsYXNoLmFuZHJvaWQuY29tggRnLmNuggYqLmcuY26CBGcu
Y2+CBiouZy5jb4IGZ29vLmdsggp3d3cuZ29vLmdsghRnb29nbGUtYW5hbHl0aWNz
LmNvbYIWKi5nb29nbGUtYW5hbHl0aWNzLmNvbYIKZ29vZ2xlLmNvbYISZ29vZ2xl
Y29tbWVyY2UuY29tghQqLmdvb2dsZWNvbW1lcmNlLmNvbYIIZ2dwaHQuY26CCiou
Z2dwaHQuY26CCnVyY2hpbi5jb22CDCoudXJjaGluLmNvbYIIeW91dHUuYmWCC3lv
dXR1YmUuY29tgg0qLnlvdXR1YmUuY29tghFtdXNpYy55b3V0dWJlLmNvbYITKi5t
dXNpYy55b3V0dWJlLmNvbYIUeW91dHViZWVkdWNhdGlvbi5jb22CFioueW91dHVi
ZWVkdWNhdGlvbi5jb22CD3lvdXR1YmVraWRzLmNvbYIRKi55b3V0dWJla2lkcy5j
b22CBXl0LmJlggcqLnl0LmJlghphbmRyb2lkLmNsaWVudHMuZ29vZ2xlLmNvbYIT
Ki5hbmRyb2lkLmdvb2dsZS5jboISKi5jaHJvbWUuZ29vZ2xlLmNughYqLmRldmVs
b3BlcnMuZ29vZ2xlLmNughUqLmFpc3R1ZGlvLmdvb2dsZS5jb20wEwYDVR0gBAww
CjAIBgZngQwBAgEwNgYDVR0fBC8wLTAroCmgJ4YlaHR0cDovL2MucGtpLmdvb2cv
d2UyL3lLNW5QaHRIS1FzLmNybDCCAQUGCisGAQQB1nkCBAIEgfYEgfMA8QB2AN3c
yjSV1+EWBeeVMvrHn/g9HFDf2wA6FBJ2Ciysu8gqAAABmOCZP0EAAAQDAEcwRQIg
R7Z79ZPmXyjH2cUgbhFE5df7Wckfkl8Q2JUA/EC1BIkCIQC+2BgvIoUTBphgBXd6
YI01mfhCyyX48u/q7LqbCTdT8QB3AO08S9boBsKkogBX28sk4jgB31Ev7cSGxXAP
IN23Pj/gAAABmOCZPzAAAAQDAEgwRgIhANqXXAmkTLOpOwwfoEgS8KjrROPgc1fD
PoQPMy9QyGR4AiEA7qf11aK06ohbR8yWQcZkaOdnsEq7pOdD+F2JMd16XAIwCgYI
KoZIzj0EAwIDRwAwRAIgVI6RF+zVUMquvp4E01QzKxKwUCdUYNgLtiehLioLp+sC
IGd3DiiOnHER3xPQgCaWJSdU9EOdII67WZ8Oet4408Cn
-----END CERTIFICATE-----
subject=CN=*.google.com
issuer=C=US, O=Google Trust Services, CN=WE2
---
No client certificate CA names sent
Peer signing digest: SHA256
Peer signature type: ECDSA
Server Temp Key: X25519, 253 bits
---
SSL handshake has read 5325 bytes and written 410 bytes
Verification: OK
---
New, TLSv1.3, Cipher is TLS_AES_256_GCM_SHA384
Protocol: TLSv1.3
Server public key is 256 bit
This TLS version forbids renegotiation.
Compression: NONE
Expansion: NONE
No ALPN negotiated
Early data was not sent
Verify return code: 0 (ok)
---
```

I think this means my synapse containers openssl is borked?

**Comment by benbz** [comment]
It feels like requests aren't correctly leaving your cluster. Could you try the `curl` command from inside the Synapse `Pod` but with `-vk` arguments (verbose + don't do verification of TLS certificates)

**Comment by linkandzelda91** [comment]
> It feels like requests aren't correctly leaving your cluster. Could you try the `curl` command from inside the Synapse `Pod` but with `-vk` arguments (verbose + don't do verification of TLS certificates)

is this helpful?
```
I have no name!@ess-synapse-main-0:/$ curl -vk https://google.com
*   Trying 69.8.81.226:443...
* Connected to google.com (69.8.81.226) port 443 (#0)
* ALPN: offers h2,http/1.1
* TLSv1.3 (OUT), TLS handshake, Client hello (1):
* TLSv1.3 (IN), TLS alert, unrecognized name (624):
* OpenSSL/3.0.17: error:0A000458:SSL routines::tlsv1 unrecognized name
* Closing connection 0
curl: (35) OpenSSL/3.0.17: error:0A000458:SSL routines::tlsv1 unrecognized name
I have no name!@ess-synapse-main-0:/$ 
```

**Comment by linkandzelda91** [comment]
wait a goddamn minute, that IP address is MINE, not google's.

what the hell?

```
C:\Users\garry.dewitt>nslookup mayogirl.com
Server:  unifi.localdomain
Address:  192.168.10.1

Non-authoritative answer:
Name:    mayogirl.com
Address:  69.8.81.226
```

**Comment by linkandzelda91** [comment]
my lack of experience with kubernetes showing, something is amiss, chatgpt told me the container should just behave like normal and use /etc/resolv.conf for dns, which appears to be the cluster IP.

but when I nslookup against the cluster IP it returns the correct value.

```
gdewitt@k3s:~/ess-config-values$ nslookup google.com 10.43.0.10
Server:         10.43.0.10
Address:        10.43.0.10#53

Non-authoritative answer:
Name:   google.com
Address: 142.251.116.100
Name:   google.com
Address: 142.251.116.101
Name:   google.com
Address: 142.251.116.138
Name:   google.com
Address: 142.251.116.139
Name:   google.com
Address: 142.251.116.113
Name:   google.com
Address: 142.251.116.102
Name:   google.com
Address: 2607:f8b0:4023:1002::65
Name:   google.com
Address: 2607:f8b0:4023:1002::66
Name:   google.com
Address: 2607:f8b0:4023:1002::71
Name:   google.com
Address: 2607:f8b0:4023:1002::8b

gdewitt@k3s:~/ess-config-values$ kubectl exec --namespace ess pods/ess-synapse-main-0 -- curl -vk https://google.com
Defaulted container "synapse" out of: synapse, render-config (init), db-wait (init)
  % Total    % Received % Xferd  Average Speed   Time    Time     Time  Current
                                 Dload  Upload   Total   Spent    Left  Speed
  0     0    0     0    0     0      0      0 --:--:-- --:--:-- --:--:--     0*   Trying 69.8.81.226:443...
* Connected to google.com (69.8.81.226) port 443 (#0)
* ALPN: offers h2,http/1.1
} [5 bytes data]
* TLSv1.3 (OUT), TLS handshake, Client hello (1):
} [512 bytes data]
* TLSv1.3 (IN), TLS alert, unrecognized name (624):
{ [2 bytes data]
* OpenSSL/3.0.17: error:0A000458:SSL routines::tlsv1 unrecognized name
  0     0    0     0    0     0      0      0 --:--:-- --:--:-- --:--:--     0
* Closing connection 0
curl: (35) OpenSSL/3.0.17: error:0A000458:SSL routines::tlsv1 unrecognized name
command terminated with exit code 35
gdewitt@k3s:~/ess-config-values$ kubectl exec --namespace ess pods/ess-synapse-main-0 -- cat /etc/resolv.conf
Defaulted container "synapse" out of: synapse, render-config (init), db-wait (init)
search ess.svc.cluster.local svc.cluster.local cluster.local mayogirl.com
nameserver 10.43.0.10
options ndots:5
gdewitt@k3s:~/ess-config-values$ 
```

**Comment by linkandzelda91** [comment]
(nslookup and dig are not available in container, and the curl version doesn't support the dns flags)

**Comment by linkandzelda91** [comment]
verified the issue can effect other pods in in the deployment too, here's element-web
```
gdewitt@k3s:~/ess-config-values$ kubectl exec -it --namespace ess ess-element-web-754d45b767-xbv2p -- /bin/sh
~ $ curl
/bin/sh: curl: not found
~ $ ping
BusyBox v1.37.0 (2025-05-26 20:04:45 UTC) multi-call binary.

Usage: ping [OPTIONS] HOST

Send ICMP ECHO_REQUESTs to HOST

        -4,-6           Force IP or IPv6 name resolution
        -c CNT          Send only CNT pings
        -s SIZE         Send SIZE data bytes in packets (default 56)
        -i SECS         Interval
        -A              Ping as soon as reply is received
        -t TTL          Set TTL
        -I IFACE/IP     Source interface or IP address
        -W SEC          Seconds to wait for the first response (default 10)
                        (after all -c CNT packets are sent)
        -w SEC          Seconds until ping exits (default:infinite)
                        (can exit earlier with -c CNT)
        -q              Quiet, only display output at start/finish
        -p HEXBYTE      Payload pattern
~ $ ping google.com
PING google.com (69.8.81.226): 56 data bytes
64 bytes from 69.8.81.226: seq=0 ttl=42 time=0.611 ms
64 bytes from 69.8.81.226: seq=1 ttl=42 time=0.528 ms
^C
--- google.com ping statistics ---
2 packets transmitted, 2 packets received, 0% packet loss
round-trip min/avg/max = 0.528/0.569/0.611 ms
~ $ 
```

**Comment by linkandzelda91** [comment]
I pulled a test pod and checked, both inside and outside of the namespace it works fine when using the cluster IP DNS. So, I think this means it's something related to the ess-helm deployment itself?

```
dewitt@k3s:~/ess-config-values$ kubectl get pods --namespace ess
NAME                                                    READY   STATUS      RESTARTS       AGE
ess-deployment-markers-post-kbmj6                       0/1     Completed   0              25h
ess-deployment-markers-pre-j5szg                        0/1     Completed   0              25h
ess-element-web-754d45b767-xbv2p                        1/1     Running     0              43h
ess-haproxy-79c4474ffd-fsmgp                            1/1     Running     0              43h
ess-init-secrets-8xjdp                                  0/1     Completed   0              25h
ess-matrix-authentication-service-64d49bf9b8-zfzgr      1/1     Running     0              43h
ess-matrix-rtc-authorisation-service-684c8cd769-cqvwj   1/1     Running     1 (4d6h ago)   6d17h
ess-matrix-rtc-sfu-54885dfcd-qqpw8                      1/1     Running     0              43h
ess-postgres-0                                          3/3     Running     7 (4d6h ago)   6d21h
ess-synapse-check-config-5lrcv                          0/1     Completed   0              25h
ess-synapse-main-0                                      1/1     Running     0              43h
shell-demo                                              1/1     Running     0              8s
gdewitt@k3s:~/ess-config-values$ kubectl exec --stdin --tty --namespace ess shell-demo -- /bin/bash
root@k3s:/# nslookup google.com 10.43.0.10
Server:         10.43.0.10
Address:        10.43.0.10#53

Non-authoritative answer:
Name:   google.com
Address: 142.250.113.139
Name:   google.com
Address: 142.250.113.138
Name:   google.com
Address: 142.250.113.113
Name:   google.com
Address: 142.250.113.102
Name:   google.com
Address: 142.250.113.101
Name:   google.com
Address: 142.250.113.100
Name:   google.com
Address: 2607:f8b0:4023:1000::8a
Name:   google.com
Address: 2607:f8b0:4023:1000::66
Name:   google.com
Address: 2607:f8b0:4023:1000::64
Name:   google.com
Address: 2607:f8b0:4023:1000::65
app.c:306:isc_app_ctxshutdown(): fatal error: kill: Permission denied (13)
Segmentation fault (core dumped)
root@k3s:/# 
```

**Comment by linkandzelda91** [comment]
for fun made a new VM and did install over again, same apparent issue with DNS in the containers: they all resolve to my own public IP.

**Comment by benbz** [comment]
I'm suspicious of your `resolv.conf`, specifically `search ess.svc.cluster.local svc.cluster.local cluster.local mayogirl.com` having your domain in it.

If you re-run your `shell-demo` `Pod` can you try running `nslookup -debug google.com` (with `-debug` and without hard-coding the DNS server. Can you also try running the same `curl` as you did inside the Synapse `Pod` incase `nslookup` doesn't respect your `/etc/resolv.conf`, you may need to change the image you're using (unsure what image you're using at present)

**Comment by linkandzelda91** [comment]
> I'm suspicious of your `resolv.conf`, specifically `search ess.svc.cluster.local svc.cluster.local cluster.local mayogirl.com` having your domain in it.
> 
> If you re-run your `shell-demo` `Pod` can you try running `nslookup -debug google.com` (with `-debug` and without hard-coding the DNS server. Can you also try running the same `curl` as you did inside the Synapse `Pod` incase `nslookup` doesn't respect your `/etc/resolv.conf`, you may need to change the image you're using (unsure what image you're using at present)


### resolve.conf entries:

on k3s host:
```
gdewitt@k3s:~$ cat /etc/resolv.conf 
# This is /run/systemd/resolve/stub-resolv.conf managed by man:systemd-resolved(8).
# Do not edit.
#
# This file might be symlinked as /etc/resolv.conf. If you're looking at
# /etc/resolv.conf and seeing this text, you have followed the symlink.
#
# This is a dynamic resolv.conf file for connecting local clients to the
# internal DNS stub resolver of systemd-resolved. This file lists all
# configured search domains.
#
# Run "resolvectl status" to see details about the uplink DNS servers
# currently in use.
#
# Third party programs should typically not access this file directly, but only
# through the symlink at /etc/resolv.conf. To manage man:resolv.conf(5) in a
# different way, replace this symlink by a static file or a different symlink.
#
# See man:systemd-resolved.service(8) for details about the supported modes of
# operation for /etc/resolv.conf.

nameserver 127.0.0.53
options edns0 trust-ad
search mayogirl.com
```

in the synapse container:
```
I have no name!@ess-synapse-main-0:/$ cat /etc/resolv.conf 
search ess.svc.cluster.local svc.cluster.local cluster.local mayogirl.com
nameserver 10.43.0.10
options ndots:5
I have no name!@ess-synapse-main-0:/$ 
```

also: element web:
```
~ $ cat /etc/resolv.conf 
search ess.svc.cluster.local svc.cluster.local cluster.local mayogirl.com
nameserver 10.43.0.10
options ndots:5
~ $ 
```

and the container I got from the kubernetes.io docs:
```
root@k3s:/# cat /etc/resolv.conf 
search mayogirl.com
nameserver 172.16.0.1
root@k3s:/# 
```

### nslookup/curl/ping testing
nslookup, dig, host, and ping are unavailable in synapse container, and I get a read only filesystem error when trying to install. I am limited to curl I think:
```
I have no name!@ess-synapse-main-0:/$ curl -v google.com
*   Trying 69.8.81.226:80...
* Connected to google.com (69.8.81.226) port 80 (#0)
> GET / HTTP/1.1
> Host: google.com
> User-Agent: curl/7.88.1
> Accept: */*
> 
< HTTP/1.1 200 OK
< Server: openresty
< Date: Mon, 15 Sep 2025 17:18:51 GMT
< Content-Type: text/html
< Content-Length: 1033
< Last-Modified: Wed, 12 Mar 2025 00:02:25 GMT
< Connection: keep-alive
< ETag: "67d0cf11-409"
< Accept-Ranges: bytes
< 
<!DOCTYPE html>
<html lang="en">
    <head>
        <meta charset="utf-8">
        <meta http-equiv="X-UA-Compatible" content="IE=edge">
        <meta name="viewport" content="width=device-width, initial-scale=1">
        <title>Default Site</title>
        <link href="https://maxcdn.bootstrapcdn.com/bootstrap/3.4.1/css/bootstrap.min.css" rel="stylesheet">
        <style>
            .jumbotron { margin-top: 50px; }
        </style>
    </head>
    <body>
        <div class="container">
            <div class="jumbotron">
                <h1>Congratulations!</h1>
                <p>You've successfully started the Nginx Proxy Manager.</p>
                <p>If you're seeing this site then you're trying to access a host that isn't set up yet.</p>
                <p>Log in to the Admin panel to get started.</p>
            </div>
            <p class="text-center"><small>Powered by <a href="https://github.com/jc21/nginx-proxy-manager" target="_blank">Nginx Proxy Manager</a></small></p>
        </div>
    </body>
</html>
* Connection #0 to host google.com left intact
I have no name!@ess-synapse-main-0:/$ 
```

element-web DOES have nslookup, so I can offer that:
```
~ $ nslookup -debug google.com
Server:         10.43.0.10
Address:        10.43.0.10:53

Query #0 completed in 3ms:
Non-authoritative answer:
Name:   google.com
Address: 142.251.116.113
Name:   google.com
Address: 142.251.116.139
Name:   google.com
Address: 142.251.116.102
Name:   google.com
Address: 142.251.116.100
Name:   google.com
Address: 142.251.116.138
Name:   google.com
Address: 142.251.116.101

Query #1 completed in 4ms:
Non-authoritative answer:
Name:   google.com
Address: 2607:f8b0:4023:1000::71
Name:   google.com
Address: 2607:f8b0:4023:1000::65
Name:   google.com
Address: 2607:f8b0:4023:1000::66
Name:   google.com
Address: 2607:f8b0:4023:1000::8a

~ $ 
```

It's correct which was encouraging...but then I tried ping and wget (curl is not available in element-web container). resolves incorrectly.
```
~ $ ping google.com
PING google.com (69.8.81.226): 56 data bytes
64 bytes from 69.8.81.226: seq=0 ttl=42 time=0.453 ms
64 bytes from 69.8.81.226: seq=1 ttl=42 time=0.429 ms
^C
--- google.com ping statistics ---
2 packets transmitted, 2 packets received, 0% packet loss
round-trip min/avg/max = 0.429/0.441/0.453 ms
~ $ 
```
```
Connecting to google.com (69.8.81.226:443)
289BDB472E780000:error:0A000458:SSL routines:ssl3_read_bytes:tlsv1 unrecognized name:ssl/record/rec_layer_s3.c:916:SSL alert number 112
ssl_client: SSL_connect
wget: error getting response: Connection reset by peer
```

suddenly it's resolving incorrectly.

and finally my test container, from here:
https://kubernetes.io/docs/tasks/debug/debug-application/get-shell-running-container/
```
root@k3s:/# nslookup -debug google.com
Server:         172.16.0.1
Address:        172.16.0.1#53

------------
    QUESTIONS:
        google.com, type = A, class = IN
    ANSWERS:
    ->  google.com
        internet address = 142.250.113.139
        ttl = 91
    ->  google.com
        internet address = 142.250.113.102
        ttl = 91
    ->  google.com
        internet address = 142.250.113.113
        ttl = 91
    ->  google.com
        internet address = 142.250.113.100
        ttl = 91
    ->  google.com
        internet address = 142.250.113.101
        ttl = 91
    ->  google.com
        internet address = 142.250.113.138
        ttl = 91
    AUTHORITY RECORDS:
    ADDITIONAL RECORDS:
------------
Non-authoritative answer:
Name:   google.com
Address: 142.250.113.139
Name:   google.com
Address: 142.250.113.102
Name:   google.com
Address: 142.250.113.113
Name:   google.com
Address: 142.250.113.100
Name:   google.com
Address: 142.250.113.101
Name:   google.com
Address: 142.250.113.138
------------
    QUESTIONS:
        google.com, type = AAAA, class = IN
    ANSWERS:
    ->  google.com
        has AAAA address 2607:f8b0:4023:1000::65
        ttl = 92
    ->  google.com
        has AAAA address 2607:f8b0:4023:1000::66
        ttl = 92
    ->  google.com
        has AAAA address 2607:f8b0:4023:1000::71
        ttl = 92
    ->  google.com
        has AAAA address 2607:f8b0:4023:1000::8a
        ttl = 92
    AUTHORITY RECORDS:
    ADDITIONAL RECORDS:
------------
Name:   google.com
Address: 2607:f8b0:4023:1000::65
Name:   google.com
Address: 2607:f8b0:4023:1000::66
Name:   google.com
Address: 2607:f8b0:4023:1000::71
Name:   google.com
Address: 2607:f8b0:4023:1000::8a
app.c:306:isc_app_ctxshutdown(): fatal error: kill: Permission denied (13)
Segmentation fault (core dumped)
```

and the ping to check, this one works as expected:
```
root@k3s:/# ping google.com
PING google.com (142.251.116.102): 56 data bytes
64 bytes from 142.251.116.102: icmp_seq=0 ttl=101 time=9.970 ms
64 bytes from 142.251.116.102: icmp_seq=1 ttl=101 time=9.512 ms
64 bytes from 142.251.116.102: icmp_seq=2 ttl=101 time=9.709 ms
^C--- google.com ping statistics ---
3 packets transmitted, 3 packets received, 0% packet loss
round-trip min/avg/max/stddev = 9.512/9.730/9.970/0.188 ms
```
and curl:
```
root@k3s:/# curl -vk https://google.com
*   Trying 142.251.186.102:443...
* Connected to google.com (142.251.186.102) port 443 (#0)
* ALPN: offers h2,http/1.1
* TLSv1.3 (OUT), TLS handshake, Client hello (1):
* TLSv1.3 (IN), TLS handshake, Server hello (2):
* TLSv1.3 (IN), TLS handshake, Encrypted Extensions (8):
* TLSv1.3 (IN), TLS handshake, Certificate (11):
* TLSv1.3 (IN), TLS handshake, CERT verify (15):
* TLSv1.3 (IN), TLS handshake, Finished (20):
* TLSv1.3 (OUT), TLS change cipher, Change cipher spec (1):
* TLSv1.3 (OUT), TLS handshake, Finished (20):
* SSL connection using TLSv1.3 / TLS_AES_256_GCM_SHA384
* ALPN: server accepted h2
* Server certificate:
*  subject: CN=*.google.com
*  start date: Aug 25 08:39:53 2025 GMT
*  expire date: Nov 17 08:39:52 2025 GMT
*  issuer: C=US; O=Google Trust Services; CN=WE2
*  SSL certificate verify result: unable to get local issuer certificate (20), continuing anyway.
* using HTTP/2
* h2h3 [:method: GET]
* h2h3 [:path: /]
* h2h3 [:scheme: https]
* h2h3 [:authority: google.com]
* h2h3 [user-agent: curl/7.88.1]
* h2h3 [accept: */*]
* Using Stream ID: 1 (easy handle 0x5febbe5777a0)
> GET / HTTP/2
> Host: google.com
> user-agent: curl/7.88.1
> accept: */*
> 
* TLSv1.3 (IN), TLS handshake, Newsession Ticket (4):
* TLSv1.3 (IN), TLS handshake, Newsession Ticket (4):
* old SSL session ID is stale, removing
< HTTP/2 301 
< location: https://www.google.com/
< content-type: text/html; charset=UTF-8
< content-security-policy-report-only: object-src 'none';base-uri 'self';script-src 'nonce-3drVgW3t1k3wCBY3OxqJ6w' 'strict-dynamic' 'report-sample' 'unsafe-eval' 'unsafe-inline' https: http:;report-uri https://csp.withgoogle.com/csp/gws/other-hp
< date: Mon, 15 Sep 2025 17:24:33 GMT
< expires: Wed, 15 Oct 2025 17:24:33 GMT
< cache-control: public, max-age=2592000
< server: gws
< content-length: 220
< x-xss-protection: 0
< x-frame-options: SAMEORIGIN
< alt-svc: h3=":443"; ma=2592000,h3-29=":443"; ma=2592000
< 
<HTML><HEAD><meta http-equiv="content-type" content="text/html;charset=utf-8">
<TITLE>301 Moved</TITLE></HEAD><BODY>
<H1>301 Moved</H1>
The document has moved
<A HREF="https://www.google.com/">here</A>.
</BODY></HTML>
* Connection #0 to host google.com left intact
root@k3s:/# 
```

**Comment by linkandzelda91** [comment]
I replace my host /etc/resolv.conf with a one line "nameserver 8.8.8.8", removed the entry for search from the netplan yaml file, and then redeployed.

it works now!

...but I dont understand why

```
I have no name!@ess-synapse-main-0:/$ curl -v google.com
*   Trying 142.251.186.100:80...
* Connected to google.com (142.251.186.100) port 80 (#0)
> GET / HTTP/1.1
> Host: google.com
> User-Agent: curl/7.88.1
> Accept: */*
> 
< HTTP/1.1 301 Moved Permanently
< Location: http://www.google.com/
< Content-Type: text/html; charset=UTF-8
< Content-Security-Policy-Report-Only: object-src 'none';base-uri 'self';script-src 'nonce-8O6X1-lkKHHMiW-DBctDWw' 'strict-dynamic' 'report-sample' 'unsafe-eval' 'unsafe-inline' https: http:;report-uri https://csp.withgoogle.com/csp/gws/other-hp
< Date: Mon, 15 Sep 2025 18:03:26 GMT
< Expires: Wed, 15 Oct 2025 18:03:26 GMT
< Cache-Control: public, max-age=2592000
< Server: gws
< Content-Length: 219
< X-XSS-Protection: 0
< X-Frame-Options: SAMEORIGIN
< 
<HTML><HEAD><meta http-equiv="content-type" content="text/html;charset=utf-8">
<TITLE>301 Moved</TITLE></HEAD><BODY>
<H1>301 Moved</H1>
The document has moved
<A HREF="http://www.google.com/">here</A>.
</BODY></HTML>
* Connection #0 to host google.com left intact
I have no name!@ess-synapse-main-0:/$ cat /etc/resolv.conf 
search ess.svc.cluster.local svc.cluster.local cluster.local
nameserver 10.43.0.10
options ndots:5
```

**Comment by benbz** [comment]
> and finally my test container, from here:
> https://kubernetes.io/docs/tasks/debug/debug-application/get-shell-running-container/

Looking at the YAML here we see

```yaml
  hostNetwork: true
  dnsPolicy: Default
```

ESS doesn't set a `dnsPolicy` so according to https://kubernetes.io/docs/concepts/services-networking/dns-pod-service/#pod-s-dns-policy
> "Default" is not the default DNS policy. If dnsPolicy is not explicitly specified, then "ClusterFirst" is used.

Possibly some of the inconsistencies seen around `nslookup` in e.g. the Element Web `Pod` might be that the search domains aren't been used either by `nslookup` itself or Alpine in general. 

> I replace my host /etc/resolv.conf with a one line "nameserver 8.8.8.8", removed the entry for search from the netplan yaml file, and then redeployed.
> 
> it works now!
> 
> ...but I dont understand why

I'm glad to hear it is working for you now. If we wanted to narrow this down, I'd suggest testing
* Adding `search mayogirl.com` back and putting the `nameserver 127.0.0.53` line back in as independent steps and retesting
* Changing / removing the `dnsPolicy` of the test `Pod`
* Use a different test image other than nginx (e.g. a Ubuntu/Debian, an Alpine) and see what happens with `nslookup`/`host`/`ping`/`curl`/etc

**Comment by linkandzelda91** [comment]
update:
### edit /etc/resolv.conf on host
```
gdewitt@k3s:~$ cat /etc/resolv.conf 
nameserver 127.0.0.53
search mayogirl.com
```
### restart and verify file contents are the same (didn't want resolvctl to recreate the old symlink)
```
gdewitt@k3s:~$ cat /etc/resolv.conf 
nameserver 127.0.0.53
search mayogirl.com
```
### delete and redeploy (same steps that fixed it last time, leaving volumes)
```
  361  helm uninstall --namespace ess ess
  362  history
  363  helm upgrade --install --namespace "ess" ess oci://ghcr.io/element-hq/ess-helm/matrix-stack -f ~/ess-config-values/hostnames.yaml -f ~/ess-config-values/tls.yaml -f ~/ess-config-values/troubleshooting.yaml -f ~/ess-config-values/oidc.yaml --wait
  364  history
gdewitt@k3s:~$ 
```
### check curl that worked after the previous fix:
```
gdewitt@k3s:~$ kubectl exec -it --namespace ess ess-synapse-main-0 -- bash
Defaulted container "synapse" out of: synapse, render-config (init), db-wait (init)
I have no name!@ess-synapse-main-0:/$ curl -vk https://google.com
*   Trying 69.8.81.226:443...
* Connected to google.com (69.8.81.226) port 443 (#0)
* ALPN: offers h2,http/1.1
* TLSv1.3 (OUT), TLS handshake, Client hello (1):
* TLSv1.3 (IN), TLS alert, unrecognized name (624):
* OpenSSL/3.0.17: error:0A000458:SSL routines::tlsv1 unrecognized name
* Closing connection 0
curl: (35) OpenSSL/3.0.17: error:0A000458:SSL routines::tlsv1 unrecognized name
I have no name!@ess-synapse-main-0:/$ 
```

It's broken again.
### back pedal, take out search mayogirl.com and redeploy
```
Last login: Wed Sep 17 14:10:09 2025 from 172.16.0.133
gdewitt@k3s:~$ cat /etc/resolv.conf 
nameserver 127.0.0.53
gdewitt@k3s:~$ helm uninstall --namespace ess ess
These resources were kept due to the resource policy:
[PersistentVolumeClaim] ess-postgres-data
[PersistentVolumeClaim] ess-synapse-media

release "ess" uninstalled
gdewitt@k3s:~$ helm upgrade --install --namespace "ess" ess oci://ghcr.io/element-hq/ess-helm/matrix-stack -f ~/ess-config-values/hostnames.yaml -f ~/ess-config-values/tls.yaml -f ~/ess-config-values/troubleshooting.yaml -f ~/ess-config-values/oidc.yaml --wait
Release "ess" does not exist. Installing it now.
Pulled: ghcr.io/element-hq/ess-helm/matrix-stack:25.9.1
Digest: sha256:fcec38460724cf34147fba96384a2ed7d6c09f7ab542306eec7f756ebf2a9d35
NAME: ess
LAST DEPLOYED: Wed Sep 17 14:19:14 2025
NAMESPACE: ess
STATUS: deployed
REVISION: 1
TEST SUITE: None
NOTES:
ESS Community 25.9.1

You are using ESS Community which is tailored to small-/mid-scale, non-commercial community use cases. If you're looking for a professional Matrix backend that is designed to support enterprise requirements and certifications, take a look at ESS Pro https://element.io/server-suite.

ESS Pro provides Long-Term Support releases, automatic scaling (horizontal and vertical) of Synapse Workers, Advanced Identity Management to manage users and spaces permissions, and more.

Feel free to join our matrix room to discuss at https://matrix.to/#/#ess-community:element.io.

To create your first user, please run the following command:
kubectl exec -n ess -it deployment/ess-matrix-authentication-service -- mas-cli manage register-user

Your chat client is available at: https://chat.mayogirl.com

You can manage your account at: https://account.mayogirl.com

To successfully federate, make sure that the Well-Known Delegation works properly using the matrix-federation-tester: https://federationtester.matrix.org/#mayogirl.com
```
### and recheck
```
gdewitt@k3s:~$ kubectl exec -it --namespace ess ess-synapse-main-0 -- bash
Defaulted container "synapse" out of: synapse, render-config (init), db-wait (init)
I have no name!@ess-synapse-main-0:/$ curl -vk https://google.com
*   Trying 142.251.116.100:443...
* Connected to google.com (142.251.116.100) port 443 (#0)
* ALPN: offers h2,http/1.1
* TLSv1.3 (OUT), TLS handshake, Client hello (1):
* TLSv1.3 (IN), TLS handshake, Server hello (2):
* TLSv1.3 (IN), TLS handshake, Encrypted Extensions (8):
* TLSv1.3 (IN), TLS handshake, Certificate (11):
* TLSv1.3 (IN), TLS handshake, CERT verify (15):
* TLSv1.3 (IN), TLS handshake, Finished (20):
* TLSv1.3 (OUT), TLS change cipher, Change cipher spec (1):
* TLSv1.3 (OUT), TLS handshake, Finished (20):
* SSL connection using TLSv1.3 / TLS_AES_256_GCM_SHA384
* ALPN: server accepted h2
* Server certificate:
*  subject: CN=*.google.com
*  start date: Sep  8 08:35:04 2025 GMT
*  expire date: Dec  1 08:35:03 2025 GMT
*  issuer: C=US; O=Google Trust Services; CN=WE2
*  SSL certificate verify result: unable to get local issuer certificate (20), continuing anyway.
* using HTTP/2
* h2h3 [:method: GET]
* h2h3 [:path: /]
* h2h3 [:scheme: https]
* h2h3 [:authority: google.com]
* h2h3 [user-agent: curl/7.88.1]
* h2h3 [accept: */*]
* Using Stream ID: 1 (easy handle 0x73fd8aac0800)
> GET / HTTP/2
> Host: google.com
> user-agent: curl/7.88.1
> accept: */*
> 
* TLSv1.3 (IN), TLS handshake, Newsession Ticket (4):
* TLSv1.3 (IN), TLS handshake, Newsession Ticket (4):
* old SSL session ID is stale, removing
< HTTP/2 301 
< location: https://www.google.com/
< content-type: text/html; charset=UTF-8
< content-security-policy-report-only: object-src 'none';base-uri 'self';script-src 'nonce-jzDH95vaAsNpO1QHMirXWw' 'strict-dynamic' 'report-sample' 'unsafe-eval' 'unsafe-inline' https: http:;report-uri https://csp.withgoogle.com/csp/gws/other-hp
< date: Wed, 17 Sep 2025 14:22:12 GMT
< expires: Fri, 17 Oct 2025 14:22:12 GMT
< cache-control: public, max-age=2592000
< server: gws
< content-length: 220
< x-xss-protection: 0
< x-frame-options: SAMEORIGIN
< alt-svc: h3=":443"; ma=2592000,h3-29=":443"; ma=2592000
< 
<HTML><HEAD><meta http-equiv="content-type" content="text/html;charset=utf-8">
<TITLE>301 Moved</TITLE></HEAD><BODY>
<H1>301 Moved</H1>
The document has moved
<A HREF="https://www.google.com/">here</A>.
</BODY></HTML>
* Connection #0 to host google.com left intact
I have no name!@ess-synapse-main-0:/$ 
```

works again.

**Comment by linkandzelda91** [comment]
CHADgpt suggested the container is appending the search domain to dns queries.
first I did rq test by setting the search to youtube.com, didn't break anything.

then, back to mayogirl.com and ran a pcap on port 53 on the host after deploying. the results were um...weird:
```
gdewitt@k3s:~$ sudo tcpdump -i any port 53 | grep google.com
tcpdump: WARNING: any: That device doesn't support promiscuous mode
(Promiscuous mode not supported on the "any" device)
tcpdump: data link type LINUX_SLL2
tcpdump: verbose output suppressed, use -v[v]... for full protocol decode
listening on any, link-type LINUX_SLL2 (Linux cooked v2), snapshot length 262144 bytes
15:01:52.921400 veth51c7c035 P   IP 10.42.0.136.36134 > 10.43.0.10.domain: 32485+ A? google.com.ess.svc.cluster.local. (50)
15:01:52.921464 vetha07bcce1 Out IP 10.42.0.136.36134 > 10.42.0.125.domain: 32485+ A? google.com.ess.svc.cluster.local. (50)
15:01:52.921495 veth51c7c035 P   IP 10.42.0.136.36134 > 10.43.0.10.domain: 13025+ AAAA? google.com.ess.svc.cluster.local. (50)
15:01:52.921510 vetha07bcce1 Out IP 10.42.0.136.36134 > 10.42.0.125.domain: 13025+ AAAA? google.com.ess.svc.cluster.local. (50)
15:01:52.922040 veth51c7c035 P   IP 10.42.0.136.46035 > 10.43.0.10.domain: 55814+ A? google.com.svc.cluster.local. (46)
15:01:52.922067 vetha07bcce1 Out IP 10.42.0.136.46035 > 10.42.0.125.domain: 55814+ A? google.com.svc.cluster.local. (46)
15:01:52.922082 veth51c7c035 P   IP 10.42.0.136.46035 > 10.43.0.10.domain: 7+ AAAA? google.com.svc.cluster.local. (46)
15:01:52.922091 vetha07bcce1 Out IP 10.42.0.136.46035 > 10.42.0.125.domain: 7+ AAAA? google.com.svc.cluster.local. (46)
15:01:52.922481 veth51c7c035 P   IP 10.42.0.136.55605 > 10.43.0.10.domain: 61146+ A? google.com.cluster.local. (42)
15:01:52.922501 vetha07bcce1 Out IP 10.42.0.136.55605 > 10.42.0.125.domain: 61146+ A? google.com.cluster.local. (42)
15:01:52.922517 veth51c7c035 P   IP 10.42.0.136.55605 > 10.43.0.10.domain: 30164+ AAAA? google.com.cluster.local. (42)
15:01:52.922526 vetha07bcce1 Out IP 10.42.0.136.55605 > 10.42.0.125.domain: 30164+ AAAA? google.com.cluster.local. (42)
15:01:52.922809 veth51c7c035 P   IP 10.42.0.136.47092 > 10.43.0.10.domain: 33000+ A? google.com.mayogirl.com. (41)
15:01:52.922846 vetha07bcce1 Out IP 10.42.0.136.47092 > 10.42.0.125.domain: 33000+ A? google.com.mayogirl.com. (41)
15:01:52.922864 veth51c7c035 P   IP 10.42.0.136.47092 > 10.43.0.10.domain: 30702+ AAAA? google.com.mayogirl.com. (41)
15:01:52.922876 vetha07bcce1 Out IP 10.42.0.136.47092 > 10.42.0.125.domain: 30702+ AAAA? google.com.mayogirl.com. (41)
15:01:52.923036 vetha07bcce1 P   IP 10.42.0.125.58694 > _gateway.domain: 58145+ A? google.com.mayogirl.com. (41)
15:01:52.923036 cni0  In  IP 10.42.0.125.58694 > _gateway.domain: 58145+ A? google.com.mayogirl.com. (41)
15:01:52.923069 ens18 Out IP k3s.29187 > _gateway.domain: 58145+ A? google.com.mayogirl.com. (41)
15:01:52.923104 vetha07bcce1 P   IP 10.42.0.125.40837 > _gateway.domain: 62349+ AAAA? google.com.mayogirl.com. (41)
15:01:52.923104 cni0  In  IP 10.42.0.125.40837 > _gateway.domain: 62349+ AAAA? google.com.mayogirl.com. (41)
15:01:52.923177 ens18 Out IP k3s.18982 > _gateway.domain: 62349+ AAAA? google.com.mayogirl.com. (41)
```

it's checking google.com, with every suffix possible appended from the /etc/resolv.conf, like google.com is not a fqdn or something.

without mayogirl.com, still checks all searchdomains first:
```
gdewitt@k3s:~$ sudo tcpdump -i any port 53 | grep google.com
[sudo] password for gdewitt: 
tcpdump: WARNING: any: That device doesn't support promiscuous mode
(Promiscuous mode not supported on the "any" device)
tcpdump: data link type LINUX_SLL2
tcpdump: verbose output suppressed, use -v[v]... for full protocol decode
listening on any, link-type LINUX_SLL2 (Linux cooked v2), snapshot length 262144 bytes
15:09:13.239244 vethad8dfa70 P   IP 10.42.0.152.57036 > 10.43.0.10.domain: 26684+ A? google.com.ess.svc.cluster.local. (50)
15:09:13.239318 veth5055a3ec Out IP 10.42.0.152.57036 > 10.42.0.141.domain: 26684+ A? google.com.ess.svc.cluster.local. (50)
15:09:13.239353 vethad8dfa70 P   IP 10.42.0.152.57036 > 10.43.0.10.domain: 3391+ AAAA? google.com.ess.svc.cluster.local. (50)
15:09:13.239366 veth5055a3ec Out IP 10.42.0.152.57036 > 10.42.0.141.domain: 3391+ AAAA? google.com.ess.svc.cluster.local. (50)
15:09:13.239907 vethad8dfa70 P   IP 10.42.0.152.57138 > 10.43.0.10.domain: 443+ A? google.com.svc.cluster.local. (46)
15:09:13.239958 veth5055a3ec Out IP 10.42.0.152.57138 > 10.42.0.141.domain: 443+ A? google.com.svc.cluster.local. (46)
15:09:13.239981 vethad8dfa70 P   IP 10.42.0.152.57138 > 10.43.0.10.domain: 60085+ AAAA? google.com.svc.cluster.local. (46)
15:09:13.239996 veth5055a3ec Out IP 10.42.0.152.57138 > 10.42.0.141.domain: 60085+ AAAA? google.com.svc.cluster.local. (46)
15:09:13.240332 vethad8dfa70 P   IP 10.42.0.152.33764 > 10.43.0.10.domain: 12329+ A? google.com.cluster.local. (42)
15:09:13.240356 veth5055a3ec Out IP 10.42.0.152.33764 > 10.42.0.141.domain: 12329+ A? google.com.cluster.local. (42)
15:09:13.240373 vethad8dfa70 P   IP 10.42.0.152.33764 > 10.43.0.10.domain: 28463+ AAAA? google.com.cluster.local. (42)
15:09:13.240407 veth5055a3ec Out IP 10.42.0.152.33764 > 10.42.0.141.domain: 28463+ AAAA? google.com.cluster.local. (42)
15:09:13.240675 vethad8dfa70 P   IP 10.42.0.152.59740 > 10.43.0.10.domain: 39878+ A? google.com. (28)
15:09:13.240702 veth5055a3ec Out IP 10.42.0.152.59740 > 10.42.0.141.domain: 39878+ A? google.com. (28)
15:09:13.240722 vethad8dfa70 P   IP 10.42.0.152.59740 > 10.43.0.10.domain: 728+ AAAA? google.com. (28)
15:09:13.240732 veth5055a3ec Out IP 10.42.0.152.59740 > 10.42.0.141.domain: 728+ AAAA? google.com. (28)
15:09:13.241009 veth5055a3ec P   IP 10.42.0.141.60225 > _gateway.domain: 58475+ A? google.com. (28)
15:09:13.241009 cni0  In  IP 10.42.0.141.60225 > _gateway.domain: 58475+ A? google.com. (28)
15:09:13.241035 veth5055a3ec P   IP 10.42.0.141.55425 > _gateway.domain: 16725+ AAAA? google.com. (28)
15:09:13.241035 cni0  In  IP 10.42.0.141.55425 > _gateway.domain: 16725+ AAAA? google.com. (28)
15:09:13.241102 ens18 Out IP k3s.58308 > _gateway.domain: 16725+ AAAA? google.com. (28)
15:09:13.241119 ens18 Out IP k3s.23023 > _gateway.domain: 58475+ A? google.com. (28)
```


adding . at the end of the query forces it to see it as an fqdn:
```
gdewitt@k3s:~$ sudo tcpdump -i any port 53 | grep google.com
tcpdump: WARNING: any: That device doesn't support promiscuous mode
(Promiscuous mode not supported on the "any" device)
tcpdump: data link type LINUX_SLL2
tcpdump: verbose output suppressed, use -v[v]... for full protocol decode
listening on any, link-type LINUX_SLL2 (Linux cooked v2), snapshot length 262144 bytes
15:10:23.200452 vethad8dfa70 P   IP 10.42.0.152.33710 > 10.43.0.10.domain: 5941+ A? google.com. (28)
15:10:23.200528 veth5055a3ec Out IP 10.42.0.152.33710 > 10.42.0.141.domain: 5941+ A? google.com. (28)
15:10:23.200554 vethad8dfa70 P   IP 10.42.0.152.33710 > 10.43.0.10.domain: 25147+ AAAA? google.com. (28)
15:10:23.200573 veth5055a3ec Out IP 10.42.0.152.33710 > 10.42.0.141.domain: 25147+ AAAA? google.com. (28)
15:10:23.200901 veth5055a3ec P   IP 10.42.0.141.45047 > _gateway.domain: 36140+ AAAA? google.com. (28)
15:10:23.200901 cni0  In  IP 10.42.0.141.45047 > _gateway.domain: 36140+ AAAA? google.com. (28)
15:10:23.200958 ens18 Out IP k3s.58860 > _gateway.domain: 36140+ AAAA? google.com. (28)
15:10:23.200958 veth5055a3ec P   IP 10.42.0.141.34417 > _gateway.domain: 52584+ A? google.com. (28)
15:10:23.200958 cni0  In  IP 10.42.0.141.34417 > _gateway.domain: 52584+ A? google.com. (28)
15:10:23.201112 ens18 Out IP k3s.61591 > _gateway.domain: 52584+ A? google.com. (28)
```

as a final test, I put mayogirl.com back in resolve, restart etc, then checked using the host itself, it's fine without the period, does not try to check the search domains first
```
gdewitt@k3s:~$ sudo tcpdump -i any port 53 | grep "google.com"
tcpdump: WARNING: any: That device doesn't support promiscuous mode
(Promiscuous mode not supported on the "any" device)
tcpdump: data link type LINUX_SLL2
tcpdump: verbose output suppressed, use -v[v]... for full protocol decode
listening on any, link-type LINUX_SLL2 (Linux cooked v2), snapshot length 262144 bytes
15:19:28.463891 lo    In  IP localhost.45221 > _localdnsstub.domain: 65213+ A? google.com. (28)
15:19:28.463925 lo    In  IP localhost.45221 > _localdnsstub.domain: 35775+ AAAA? google.com. (28)
15:19:28.464133 ens18 Out IP k3s.60494 > _gateway.domain: 13522+ [1au] A? google.com. (39)
15:19:28.464276 ens18 Out IP k3s.38578 > _gateway.domain: 5691+ [1au] AAAA? google.com. (39)
```

above my paygrade to why they are different, but hope it helps.

**Comment by benbz** [comment]
> it's checking google.com, with every suffix possible appended from the /etc/resolv.conf, like google.com is not a fqdn or something.

This is definition of what search domains does. It tells your local DNS resolver to check the name it is looking up as to whether it is a sub-domain under each and every one of the search domains. This is also why adding the `.` at the end stops this behaviour as that is telling your local DNS resolver that this isn't a sub-domain and is a fully formed address already and so no search domains are consulted.

Whatever DNS server you have serving `mayogirl.com` is configured with wildcard DNS and responding to everything
```sh
$ host google.com.mayogirl.com
google.com.mayogirl.com has address 69.8.81.226
$ host i-have-just-totally-made-this-up-now.some-tld.mayogirl.com 
i-have-just-totally-made-this-up-now.some-tld.mayogirl.com has address 69.8.81.226
```

I can't say why you don't see that on the host, but arguably with `search mayogirl.com` what's happening in cluster is correct (the search domain being considered) rather than your host (not consulting the search domain).

Resolving this as we've got to the bottom of this mystery and isn't an ESS issue

**Comment by linkandzelda91** [comment]
> t

Something about this was bugging me so I dug a little deeper. Why was my host working fine without the period to force fqdn? I think the answer is ``ndots``:
https://pracucci.com/kubernetes-dns-resolution-ndots-options-and-why-it-may-affect-application-performances.html

this explained it well enough, and from there I was able to check and see that the ubuntu default resolved value for ndots if resolve.conf doesn't contain an override is 1.

so, when I query google.com, the single . in the query tells the host this should be treated as a fqdn, regardless of me ending it in a period. in the containers, they are being set to ndots:5
so google.com gets resolved to everything in the searchdomain FIRST, then treated as a fqdn as a last resort.

As you said, I have a wildcard record for my personal domain, which is a popular choice for people hosting things at home so we dont have to create new DNS records everytime we want to add a service.

To confirm this, I set my host ndots to 2, and retested. behaves as expected, google.com is treated as a local search first with the domain mayogirl.com, which returns a result because of the wildcard.
But, photos.google.com resolves correctly, ndots working correctly on the host.

I'm happy to have learned something new about how dns works on linux, but it does kinda suck that the default value of 5 in the pods means most dns queries are going to try to route through every search domain in the deployment.

**Comment by benbz** [comment]
And the final mystery solved! I'm glad we've an explanation for all the behaviour seen

We've actually moved to having all cluster internal requests being made with a trailing dot (#692). The article you've linked would be reasonable justification for opening an issue to make `Pod.spec.dnsConfig` configurable in chart. Low priority from our PoV but a reasonable request
